<?xml version="1.0"?>
<!DOCTYPE projectrecord SYSTEM "projectrecord.dtd">
<projectrecord>
	<cabecalho>
		<titulo>Criação de Project Record</titulo>
		<subtitulo>Project Record 1</subtitulo>
		<data-inicio>21/10/2020</data-inicio>
		<data-fim>28/10/2020</data-fim>
		<supervisor>José Carlos Ramalho</supervisor>
	</cabecalho>
	<apresentacao>
		<nr-aluno>pg42830</nr-aluno>
		<nome>Gonçalo Veloso</nome>
		<email>pg42830@alunos.uminho.pt</email>
	</apresentacao>
	<abstract>
		<paragrafo>
			<texto>
				<normal>A criação do <bold>primeiro project record</bold> foi realizada um pouco através do estudo dos conceitos de DTD e XML, não podendo comprovar, por mim, que tudo aqui realizado está feito da melhor maneira. </normal>
			</texto>
		</paragrafo>
	</abstract>
	<entregavel>
		<link href="https://github.com/gveloso9983/DAW2020">Github</link>
	</entregavel>
</projectrecord>
